fd1c5986-b9a0-4d15-9799-8d67a9a519c0;What has roots as nobody sees, is taller than trees, up, up, up it goes, and yet, never grows?;Mountain
7cdf8202-a0fe-46ed-acff-46ff7b495c5f;Thirty white horses on a red hill. First they champ,then they stamp, then they stand still.;Teeth
46f5d2a0-bb7f-44b4-95e3-ddfdd42046ca;Voiceless it cries, wingless flutters,toothless bites, mouhless mutters.;Wind
a4a24d17-63c2-4b1c-838f-dc5fdfb394a3;An eye in a blue face. Saw an eye in a green face. 'That eye is like to this eye' Said the first eye, But in low place, Not in high place.;The Sun
3642cd4a-9a93-4e14-9018-22b15a4eca7f;It cannot be seen, cannot be felt, Cannot be heard, cannot be smelt. It lies behind stars and under hills, And empty holes it fills. It comes first and follows after, Ends life, kills laughter.;Dark
e16d33fe-a6a9-4425-882c-b4d96b05795e;It cannot be seen, cannot be felt, Cannot be heard, cannot be smelt. It lies behind stars and under hills, And empty holes it fills. It comes first and follows after, Ends life, kills laughter.;Dark
